Program Link,Program Name,Website,Name,ACGME Program Code,Program Director,PD Gender,Program Coordinator,PGY1,PGY2,PGY3,Region,Institutional Setting,Participates in ERAS,Program has Osteopathic Recognition,# of Residents Who Were Graduates of a Joint MD-PhD program,Categorical Positions,Categorical Positions Filled,Advanced Positions Offered,Advanced Positions Filled,# of Applicants:,II Rate,Interviews,Total Spots,Post II Odds,Spots/Apps,Alpha Omega Alpha (AOA),Gold Humanism Honor Society (GHHS),Sigma Sigma Phi (SSP)
/Program/GetById/289,Baylor College of Medicine Program,http://www.bcm.edu/dermatology,Baylor College of Medicine Program,804821087,Omid Jalali,,Rose Ewing,4,4,4,West South Central,University Hospital,Yes,No,–,–,# of Positions Filled:,4,4,639,7.8,50,4,8%,0.63%,67%,6%,0%
/Program/GetById/220,Baylor University Medical Center Program,https://www.bswhealth.med/education/Pages/gme/dallas/dermatology-residency.aspx,Baylor University Medical Center Program,804813142,Dario Kivelevitch,,Taylor Martinez,1,1,0,West South Central,Affiliated Hospital,Yes,No,–,–,# of Positions Filled:,2,2,0,–,#VALUE!,2,#VALUE!,#DIV/0!,–,–,–
/Program/GetById/258,Beaumont Health (Farmington Hills) Program,https://www.beaumont.edu/graduate-medical-education/residency-programs/dermatology/dermatology-residency-farmington-hills,Beaumont Health (Farmington Hills) Program,802500142,Lynn Sikorski,,Kathleen Summers,2,2,2,East North Central,Community Hospital,Yes,Yes,–,2,2,–,# of Positions Filled:,331,7.3,24,2,8%,0.60%,–,–,–
/Program/GetById/275,Beaumont Health (Trenton) Program,http://www.beaumont.edu,Beaumont Health (Trenton) Program,802500145,Steven Grekin,,Melissa Arthur,2,2,2,East North Central,Community Hospital,Yes,No,–,2,2,–,# of Positions Filled:,392,6.4,25,2,8%,0.51%,–,–,–
/Program/GetById/227,Boston University Medical Center Program,https://www.bumc.bu.edu/derm/training-programs-overview/boston-medical-center-residency-program/,Boston University Medical Center Program,802421044,Lisa Shen,,Tara Cusack,5,5,4,New England,University Hospital,Yes,No,–,–,# of Positions Filled:,5,5,626,10.4,65,5,8%,0.80%,44%,20%,0%
/Program/GetById/188,Broward Health Program,https://gme.browardhealth.org/program-category/residency/program/dermatology,Broward Health Program,801100138,Carlos Nousari,,Tanequa Dowdell,3,3,3,South Atlantic,Affiliated Hospital,Yes,No,–,–,# of Positions Filled:,3,3,515,14,72,3,4%,0.58%,31%,13%,13%
/Program/GetById/212,Brown University Program,https://www.brown.edu/academics/medical/about/departments/dermatology/,Brown University Program,804321122,John Kawaoka,,Erika Abou Kelila,4,5,6,New England,University Hospital,Yes,No,–,–,# of Positions Filled:,4,4,665,6.8,45,4,9%,0.60%,55%,10%,0%
/Program/GetById/175,Campbell University Program,http://www.sampsonrmc.org,,,,,,,,,,,,,,,,,,,,0,,#DIV/0!,#DIV/0!,,,
/Program/GetById/182,Carilion Clinic-Virginia Tech Carilion School of Medicine Program,https://carilionclinic.org/dermatology-residency#about,Carilion Clinic-Virginia Tech Carilion School of Medicine Program,805100131,Mariana Phillips,,Katelyn Dunbar,2,1,1,South Atlantic,Affiliated Hospital,Yes,No,–,–,# of Positions Filled:,2,2,461,6.5,30,2,7%,0.43%,–,–,–
/Program/GetById/217,Case Western Reserve University/University Hospitals Cleveland Medical Center Program,https://www.uhhospitals.org/services/dermatology-services/for-clinicians/clinical-education/dermatology-residency,Case Western Reserve University/University Hospitals Cleveland Medical Center Program,803821120,Timmie Sharma,,Kristina Myers,6,6,6,East North Central,University Hospital,Yes,Yes,1,–,# of Positions Filled:,6,6,705,8.8,62,6,10%,0.85%,23%,10%,20%
/Program/GetById/208,Cleveland Clinic Foundation Program,http://www.clevelandclinic.org/dermresidency,Cleveland Clinic Foundation Program,803812070,Alok Vij,,Cheryl Williams,4,4,3,East North Central,Affiliated Hospital,Yes,No,–,4,4,–,# of Positions Filled:,673,7.1,48,4,8%,0.59%,45%,30%,0%
/Program/GetById/209,Cook County Health and Hospitals System Program,https://cookcountyhealth.org/education-research/residency-programs/dermatology/,Cook County Health and Hospitals System Program,801612030,David Othman,,Talath Ahmed,3,4,4,East North Central,Community Hospital,Yes,No,–,–,# of Positions Filled:,3,3,608,4.9,30,3,10%,0.49%,12%,24%,0%
/Program/GetById/203,Dartmouth-Hitchcock/Mary Hitchcock Memorial Hospital Program,https://gme.dartmouth-hitchcock.org/dermatology,Dartmouth-Hitchcock/Mary Hitchcock Memorial Hospital Program,803221053,Joi Carter,,Kelly Rose,3,3,3,New England,University Hospital,Yes,No,–,–,# of Positions Filled:,3,3,584,6.8,40,3,8%,0.51%,27%,0%,0%
/Program/GetById/249,Dermatologists of Central States (DOCS) Program,https://www.mwdermatology.com/index.html,Dermatologists of Central States (DOCS) Program,802500001,David Altman,,Patrice Robertson,0,0,0,East North Central,Not Available,–,No,–,–,# of Positions Filled:,–,# of Positions Filled:,0,–,#VALUE!,,#VALUE!,#DIV/0!,–,–,–
/Program/GetById/250,Duke University Hospital Program,https://dermatology.duke.edu/,Duke University Hospital Program,803621067,Erin Lesesky,,Jessica Braddock,5,5,5,South Atlantic,University Hospital,Yes,No,2,–,# of Positions Filled:,6,6,731,6.8,50,6,12%,0.82%,27%,15%,0%
/Program/GetById/261,Eastern Virginia Medical School Program,http://www.evms.edu/education/centers_institutes_departments/dermatology/residency/,Eastern Virginia Medical School Program,805121130,Abby Van Voorhees,,April McGuire,3,1,3,South Atlantic,Affiliated Hospital,Yes,No,–,–,# of Positions Filled:,2,2,579,6.4,37,2,5%,0.35%,25%,8%,0%
/Program/GetById/205,Emory University School of Medicine Program,http://www.dermatology.emory.edu,Emory University School of Medicine Program,801221028,Jamie MacKelfresh,,Catherine Thayer,7,6,7,South Atlantic,Not Available,Yes,No,1,–,# of Positions Filled:,6,6,766,–,#VALUE!,6,#VALUE!,0.78%,33%,15%,0%
/Program/GetById/273,Geisinger Health System Program,https://www.geisinger.edu/education/residencies-fellowships/residencies/dermatology-residency,Geisinger Health System Program,804112076,Eric Hossler,,Tammy Rodenhaver,4,4,4,Middle Atlantic,Community Hospital,Yes,No,–,–,# of Positions Filled:,4,4,601,6.7,40,4,10%,0.67%,70%,20%,0%
/Program/GetById/211,Hackensack University Medical Center (Palisades) Program,http://www.palisadesmedical.org/Content/106/dermatology-residency-program.html,Hackensack University Medical Center (Palisades) Program,803300129,Adriana Ros,,Maria Pallarino,3,3,3,Middle Atlantic,Affiliated Hospital,Yes,No,–,–,# of Positions Filled:,3,3,488,6.1,30,3,10%,0.61%,6%,0%,11%
/Program/GetById/254,HCA Florida Healthcare/USF Morsani College of Medicine GME Largo Hospital Program,https://www.hcafloridahealthcare.com/for-medical-professionals/graduate-medical-education/largo-hospital/dermatology,HCA Florida Healthcare/USF Morsani College of Medicine GME Largo Hospital Program,801100139,Richard Miller,,Jessica Biarnes,3,3,3,South Atlantic,Community Hospital,Yes,No,–,–,# of Positions Filled:,3,3,475,5.1,24,3,13%,0.63%,0%,13%,40%
/Program/GetById/270,HCA Florida Orange Park Hospital Program,https://orangeparkmedical.com/physicians/graduate-medical-education/dermatology/,HCA Florida Orange Park Hospital Program,801100140,Karthik Krishnamurthy,,Leah Todd,3,3,3,South Atlantic,Affiliated Hospital,Yes,No,–,–,# of Positions Filled:,3,3,446,9,40,3,8%,0.67%,11%,17%,22%
/Program/GetById/293,HCA Healthcare Corpus Christi Medical Center - Bay Area Program,http://www.dermresidency.org,HCA Healthcare Corpus Christi Medical Center - Bay Area Program,804800145,Rick Lin,,Alberto Najera,2,2,1,West South Central,Community Hospital,Yes,No,–,–,# of Positions Filled:,1,1,338,4.4,15,1,7%,0.30%,–,–,–
/Program/GetById/266,HCA Healthcare LewisGale Hospital-Montgomery/VCOM Program,https://lewisgale.com/locations/lewisgale-montgomery/graduate-medical-education/,HCA Healthcare LewisGale Hospital-Montgomery/VCOM Program,805100132,Chad Johnston,,Donna Underwood,2,2,2,South Atlantic,Community Hospital,Yes,No,–,–,# of Positions Filled:,2,2,402,6.2,25,2,8%,0.50%,–,–,–
/Program/GetById/216,HCA Medical City Healthcare UNT-TCU GME (Fort Worth) Program,–,HCA Medical City Healthcare UNT-TCU GME (Fort Worth) Program,804800144,Stephen Weis,,Kavina Bhula,1,1,1,West South Central,Affiliated Hospital,Yes,No,–,–,# of Positions Filled:,1,1,361,5,18,1,6%,0.28%,–,–,–
/Program/GetById/177,HealthPartners Institute Program,http://healthpartnersdermatologyresidency.com/,HealthPartners Institute Program,802600050,Neal Foman,,Gretchen Jackson,3,2,2,West North Central,Community Hospital,Yes,No,–,–,# of Positions Filled:,3,3,542,5.5,30,3,10%,0.55%,36%,36%,18%
/Program/GetById/166,Henry Ford Health/Henry Ford Hospital Program,http://www.henryford.com/body_program.cfm?id=49992,Henry Ford Health/Henry Ford Hospital Program,802512046,Holly Kerr,,Monica Murphy,7,7,7,East North Central,Affiliated Hospital,Yes,No,–,–,# of Positions Filled:,7,7,673,12.2,82,7,9%,1.04%,43%,26%,0%
/Program/GetById/176,HES/Lake Granbury Medical Center Program,–,HES/Lake Granbury Medical Center Program,804800001,Clay Cockerell,,Aurea Baez-Martinez,0,0,0,West South Central,Affiliated Hospital,Yes,No,–,–,# of Positions Filled:,–,# of Positions Filled:,0,–,#VALUE!,,#VALUE!,#DIV/0!,–,–,–
/Program/GetById/178,HonorHealth Program,https://www.honorhealth.com/academic-affairs/dermatology-residency-program/residents,HonorHealth Program,800300148,Christopher Reardon,,Maira Israel,2,2,2,Mountain,Community Hospital,Yes,No,–,–,# of Positions Filled:,2,2,455,6.6,30,2,7%,0.44%,0%,0%,10%
/Program/GetById/181,Howard University Program,http://huhosp.org/Education/GME/Residency/Dermatology.htm,Howard University Program,801021025,Cheri Frey,,Alonda Thompson,5,3,3,South Atlantic,University Hospital,Yes,No,–,–,# of Positions Filled:,3,3,535,9,48,3,6%,0.56%,16%,16%,0%
/Program/GetById/210,Icahn School of Medicine at Mount Sinai Program,http://www.mountsinaidermatology.com,Icahn School of Medicine at Mount Sinai Program,803500127,Alexandra Golant,,Diana Ramos,9,10,9,Middle Atlantic,University Hospital,Yes,No,–,–,# of Positions Filled:,9,9,594,0,0,9,#DIV/0!,1.52%,34%,9%,0%
/Program/GetById/213,Indiana University School of Medicine Program,http://dermatology.medicine.iu.edu,Indiana University School of Medicine Program,801721035,Nidhi Avashia-Khemka,,Kelli Cassidy,0,4,4,East North Central,Affiliated Hospital,Yes,No,–,2,2,2,2,627,7.2,45,4,9%,0.64%,78%,17%,0%
/Program/GetById/215,Kaiser Permanente Southern California (Los Angeles) Program,https://residency-scal-kaiserpermanente.org/residency/dermatology/,Kaiser Permanente Southern California (Los Angeles) Program,800512144,Jeremy Man,,Louis Arevalo,2,3,2,Pacific,Community Hospital,Yes,No,–,2,2,–,# of Positions Filled:,400,6.5,26,2,8%,0.50%,40%,0%,0%
/Program/GetById/219,Kansas City University GME Consortium (KCU-GME Consortium)/ADCS-Orlando Program,http://orlandodermresidency.com,Kansas City University GME Consortium (KCU-GME Consortium)/ADCS-Orlando Program,801100141,Jere Mammino,,Kayla Alvarez,3,3,3,South Atlantic,Affiliated Hospital,Yes,No,–,–,# of Positions Filled:,3,3,427,7.7,33,3,9%,0.70%,13%,27%,33%
/Program/GetById/198,Kansas City University GME Consortium (KCU-GME Consortium) Phoenix Program,https://omnidermatology.com/,Kansas City University GME Consortium (KCU-GME Consortium) Phoenix Program,800300146,Andrew Racette,,Tiffany Muser,0,2,2,Mountain,Affiliated Hospital,–,No,–,–,# of Positions Filled:,–,# of Positions Filled:,0,–,#VALUE!,,#VALUE!,#DIV/0!,–,–,–
/Program/GetById/229,Larkin Community Hospital Palm Springs Campus Program,http://www.larkinhospital.com/,Larkin Community Hospital Palm Springs Campus Program,801100144,Brad Glick,,Rita Mayorga,4,3,3,South Atlantic,Community Hospital,Yes,No,–,–,# of Positions Filled:,5,5,594,–,#VALUE!,5,#VALUE!,0.84%,0%,7%,21%
/Program/GetById/233,Larkin Community Hospital Program,https://www.graduatemedicaleducation.org/,Larkin Community Hospital Program,801100143,Stanley Skopit,,Lisandra Inastrilla,5,5,5,South Atlantic,Community Hospital,Yes,No,–,–,# of Positions Filled:,6,3,829,12.1,100,6,6%,0.72%,8%,8%,13%
/Program/GetById/238,Lehigh Valley Health Network Program,http://www.lvhn.org/research_and_education/residents/residency_programs/dermatology,Lehigh Valley Health Network Program,804100105,Cynthia Bartus,,Michelle Brown,2,2,2,Middle Atlantic,Affiliated Hospital,Yes,No,–,–,# of Positions Filled:,2,2,480,4.2,20,2,10%,0.42%,–,–,–
/Program/GetById/257,Loma Linda University Health Education Consortium Program,http://www.llu.edu/llumc/residency/train.htm,Loma Linda University Health Education Consortium Program,800521111,Janiene Luke,,Cindi Morrill,3,3,3,Pacific,University Hospital,Yes,No,–,–,# of Positions Filled:,3,3,534,5.6,30,3,10%,0.56%,47%,20%,0%
/Program/GetById/276,Los Angeles County-Harbor-UCLA Medical Center Program,http://www.harbor-ucla.org/dermatology/,Los Angeles County-Harbor-UCLA Medical Center Program,800512137,Delphine Lee,,Paige Kobayashi,2,2,2,Pacific,Affiliated Hospital,Yes,No,–,–,# of Positions Filled:,2,2,539,5.6,30,2,7%,0.37%,–,–,–
/Program/GetById/278,Louisiana State University School of Medicine Program,http://www.medschool.lsuhsc.edu/dermatology/,Louisiana State University School of Medicine Program,802121109,Deborah Hilton,,Sherilyn Munoz,6,4,6,West South Central,Affiliated Hospital,Yes,No,–,–,# of Positions Filled:,5,5,570,5.3,30,5,17%,0.88%,61%,14%,0%
/Program/GetById/252,Loyola University Medical Center Program,http://www.stritch.luc.edu/medicine/residency-dermatology,Loyola University Medical Center Program,801612135,Eden Lake,,Kathy Kania,3,4,3,East North Central,University Hospital,Yes,No,–,–,# of Positions Filled:,4,4,659,5.5,36,4,11%,0.61%,59%,0%,0%
/Program/GetById/199,Marshfield Clinic Program,http://www3.marshfieldclinic.org/residents/,Marshfield Clinic Program,805622131,Erik Stratman,,Aimie Eckelberg,2,2,2,East North Central,Affiliated Hospital,Yes,No,–,–,# of Positions Filled:,2,2,403,7.4,30,2,7%,0.50%,–,–,–
/Program/GetById/173,Massachusetts General Hospital/Beth Israel Deaconess Medical Center/Brigham and Women's Hosp Program,http://www2.massgeneral.org/hmsdermatology/,Massachusetts General Hospital/Beth Israel Deaconess Medical Center/Brigham and Women's Hosp Program,802431043,Jennifer Huang,,Diane Kovacev,8,8,10,New England,Affiliated Hospital,Yes,No,5,–,# of Positions Filled:,8,8,617,7.5,46,8,17%,1.30%,29%,12%,0%
/Program/GetById/281,Mayo Clinic College of Medicine and Science (Jacksonville) Program,https://college.mayo.edu/academics/residencies-and-fellowships/dermatology-residency-florida/,Mayo Clinic College of Medicine and Science (Jacksonville) Program,801131125,Leila Tolaymat,,Cindy Fairchild,2,2,2,South Atlantic,Other,Yes,No,–,2,2,–,# of Positions Filled:,579,4.5,26,2,8%,0.35%,30%,10%,0%
/Program/GetById/294,Mayo Clinic College of Medicine and Science (Rochester) Program,https://college.mayo.edu/academics/residencies-and-fellowships/dermatology-residency-minnesota/,Mayo Clinic College of Medicine and Science (Rochester) Program,802621049,Carilyn Wieland,,Julie Fohrman,8,8,8,West North Central,Other,Yes,No,–,2,2,6,6,666,10.4,69,8,12%,1.20%,45%,10%,0%
/Program/GetById/288,Mayo Clinic College of Medicine and Science (Scottsdale) Program,http://www.mayo.edu/msgme,Mayo Clinic College of Medicine and Science (Scottsdale) Program,800321127,David Swanson,,Kristy Lux,2,2,2,Mountain,Other,Yes,No,–,2,2,–,# of Positions Filled:,590,4.2,25,2,8%,0.34%,–,–,–
/Program/GetById/299,McGaw Medical Center of Northwestern University Program,http://www.feinberg.northwestern.edu/depts/dermatology/education/,McGaw Medical Center of Northwestern University Program,801621031,Maria Colavincenzo,,Lisa Glatz,4,4,4,East North Central,University Hospital,Yes,No,5,–,# of Positions Filled:,6,6,689,10.9,75,6,8%,0.87%,57%,13%,0%
/Program/GetById/282,Medical College of Georgia Program,https://www.augusta.edu/mcg/dermatology/,Medical College of Georgia Program,801211029,Loretta Davis,,Jennifer Foskey,3,3,3,South Atlantic,University Hospital,Yes,No,1,–,# of Positions Filled:,3,3,527,7.2,38,3,8%,0.57%,40%,7%,0%
/Program/GetById/300,Medical College of Wisconsin Affiliated Hospitals Program,http://www.mcw.edu/derm,Medical College of Wisconsin Affiliated Hospitals Program,805621095,Karolyn Wanat,,Jennifer Pluer,5,5,5,East North Central,University Hospital,Yes,No,–,–,# of Positions Filled:,5,5,628,8.6,54,5,9%,0.80%,35%,12%,4%
/Program/GetById/305,Medical University of South Carolina Program,http://clinicaldepartments.musc.edu/dermatology,Medical University of South Carolina Program,804521099,Richard Marchell,,Mark Lynch,4,5,5,South Atlantic,University Hospital,Yes,No,–,1,–,4,4,679,6.2,42,5,12%,0.74%,83%,17%,0%
/Program/GetById/214,MedStar Health/Washington Hospital Center Program,https://www.medstarhealth.org/education/affiliated-hospitals-2/medstar-washington-hospital-center/dermatology-residency/,MedStar Health/Washington Hospital Center Program,801021106,Min Deng,,Naomi Simwenyi,2,3,1,South Atlantic,Affiliated Hospital,Yes,No,–,–,# of Positions Filled:,3,3,620,6.5,40,3,8%,0.48%,50%,8%,0%
/Program/GetById/304,Montefiore Medical Center/Albert Einstein College of Medicine Program,http://www.aecom.yu.edu,Montefiore Medical Center/Albert Einstein College of Medicine Program,803531058,Ranon Mann,,Karen Grant,6,7,6,Middle Atlantic,University Hospital,Yes,No,–,–,# of Positions Filled:,7,7,652,9.2,60,7,12%,1.07%,34%,13%,0%
/Program/GetById/279,National Capital Consortium Program,–,National Capital Consortium Program,801021123,Luke Bloomquist,,Chaconia Agyenkwah,4,5,4,South Atlantic,Not Available,–,No,–,–,# of Positions Filled:,–,# of Positions Filled:,0,–,#VALUE!,,#VALUE!,#DIV/0!,–,–,–
/Program/GetById/262,Naval Medical Center (San Diego) Program,http://www-nmcsd.med.navy.mil/command/index.cfm,Naval Medical Center (San Diego) Program,800531006,Vikas Shrivastava,,Neil Gibbs,3,2,2,Pacific,Not Available,–,No,–,–,# of Positions Filled:,–,# of Positions Filled:,0,–,#VALUE!,,#VALUE!,#DIV/0!,–,–,–
/Program/GetById/245,New York Medical College (Metropolitan) Program,http://www.nymc.edu/medical/medical.asp,New York Medical College (Metropolitan) Program,803521063,Marian Russo,,Magali Cruz,4,3,3,Middle Atlantic,University Hospital,Yes,No,–,–,# of Positions Filled:,2,2,580,9.7,56,2,4%,0.34%,10%,20%,0%
/Program/GetById/223,New York Presbyterian Hospital (Columbia Campus) Program,http://www.dermatology.columbia.edu,New York Presbyterian Hospital (Columbia Campus) Program,803521104,Stephanie Gallitano,,Christine Lauren,3,5,4,Middle Atlantic,University Hospital,Yes,No,1,–,# of Positions Filled:,5,5,635,8,51,5,10%,0.79%,24%,10%,0%
/Program/GetById/231,New York Presbyterian Hospital (Cornell Campus) Program,http://www.cornelldermatology.org/,New York Presbyterian Hospital (Cornell Campus) Program,803521062,Horatio Wildman,,Mynaria Everett,5,4,4,Middle Atlantic,University Hospital,Yes,No,2,–,# of Positions Filled:,4,4,638,7.8,50,4,8%,0.63%,57%,19%,0%
/Program/GetById/253,NYU Grossman School of Medicine Program,http://www.med.nyu.edu/derm/index.html,NYU Grossman School of Medicine Program,803521064,Alexandra Flamm,,Norma Elliott,8,8,9,Middle Atlantic,University Hospital,Yes,No,1,–,# of Positions Filled:,8,8,636,8.6,55,8,15%,1.26%,45%,21%,0%
/Program/GetById/248,Ohio State University Hospital Program,https://medicine.osu.edu/departments/dermatology/education/residency,Ohio State University Hospital Program,803811072,Joy Mosser-Goldfarb,,crisanne Hitler,0,4,3,East North Central,University Hospital,Yes,No,–,2,2,2,2,678,4.9,33,4,12%,0.59%,41%,6%,0%
/Program/GetById/237,OhioHealth/Riverside Methodist Hospital Program,http://www.ohiohealth.com/education/medical-education-program/residencies-and-fellowships/dermatology-obleness-hospital/,OhioHealth/Riverside Methodist Hospital Program,803800144,Dawn Sammons,,Rachel Roberts,2,2,2,East North Central,Affiliated Hospital,Yes,No,–,2,2,–,# of Positions Filled:,430,4.9,21,2,10%,0.47%,25%,17%,25%
/Program/GetById/295,Oregon Health & Science University Program,http://www.ohsu.edu/dermatology,Oregon Health & Science University Program,804021075,Nicole Fett,,Sarah Wilkinson,5,5,5,Pacific,University Hospital,Yes,No,–,–,# of Positions Filled:,5,5,675,7.1,48,5,10%,0.74%,44%,16%,8%
/Program/GetById/170,Penn State Milton S Hershey Medical Center Program,https://residency.med.psu.edu/programs/dermatology-residency/,Penn State Milton S Hershey Medical Center Program,804121103,Brian Green,,Kelly Friedman,7,1,4,Middle Atlantic,University Hospital,Yes,No,1,–,# of Positions Filled:,4,4,656,5.3,35,4,11%,0.61%,30%,15%,10%
/Program/GetById/206,Philadelphia College of Osteopathic Medicine Program,http://www.dermatologynfhmc.wix.com/gaderm,Philadelphia College of Osteopathic Medicine Program,801200030,Marcus Goodman,,sandy Ingram,2,2,2,South Atlantic,Affiliated Hospital,Yes,No,–,–,# of Positions Filled:,2,2,382,13.1,50,2,4%,0.52%,–,–,–
/Program/GetById/186,Ponce Health Sciences University Program,http://www.phsu.edu,Ponce Health Sciences University Program,804200001,Nestor Sanchez Colon,,Yeroika Echevarría,0,0,0,South Atlantic,Not Available,–,No,–,–,# of Positions Filled:,–,# of Positions Filled:,0,–,#VALUE!,,#VALUE!,#DIV/0!,–,–,–
/Program/GetById/235,Prime West Consortium/Newport Beach Program,https://westernderm.com,Prime West Consortium/Newport Beach Program,800500145,Navid Nami,,Kristina Garcia,1,1,1,Pacific,Affiliated Hospital,Yes,No,–,–,# of Positions Filled:,1,1,133,9,12,1,8%,0.75%,–,–,–
/Program/GetById/239,Rush University Medical Center Program,https://www.rushu.rush.edu/rush-medical-college/departments/department-dermatology,Rush University Medical Center Program,801611032,David Reid,,Lynn Thompson,3,2,2,East North Central,University Hospital,Yes,No,–,–,# of Positions Filled:,2,2,663,5.3,35,2,6%,0.30%,40%,10%,0%
/Program/GetById/171,Rutgers Health/Robert Wood Johnson Medical School Program,http://rwjms.rutgers.edu/departments_institutes/dermatology/residency/index.html,Rutgers Health/Robert Wood Johnson Medical School Program,803331128,Cindy Wassef,,Aida Cardona,2,2,2,Middle Atlantic,University Hospital,Yes,No,–,–,# of Positions Filled:,2,2,614,0,0,2,#DIV/0!,0.33%,10%,0%,0%
/Program/GetById/184,Samaritan Health Services - Corvallis Program,http://www.silverfallsderm.net,Samaritan Health Services - Corvallis Program,804000076,Jacques Casparian,,Zoia Martushev,2,3,2,Pacific,Community Hospital,Yes,No,–,–,# of Positions Filled:,2,2,409,4.9,20,2,10%,0.49%,–,–,–
/Program/GetById/285,San Antonio Uniformed Services Health Education Consortium Program,https://bamc.tricare.mil/About-Us/SAUSHEC/Residency-Information/Dermatology,San Antonio Uniformed Services Health Education Consortium Program,804821121,Christopher Edens,,Teresa Fite,6,4,6,West South Central,Not Available,–,No,–,–,# of Positions Filled:,–,# of Positions Filled:,0,–,#VALUE!,,#VALUE!,#DIV/0!,–,–,–
/Program/GetById/301,Sidney Kimmel Medical College at Thomas Jefferson University/TJUH Program,http://www.jefferson.edu/university/skmc/departments/dermatology.html,Sidney Kimmel Medical College at Thomas Jefferson University/TJUH Program,804111079,Matthew Keller,,Doreen Barel,4,6,4,Middle Atlantic,University Hospital,Yes,No,–,–,# of Positions Filled:,4,4,665,4.8,32,4,13%,0.60%,32%,18%,0%
/Program/GetById/189,Southern Illinois University Program,https://www.siumed.edu/im/dermatology,Southern Illinois University Program,801621118,Adam Berry,,Pamela Larson,3,3,3,East North Central,University Hospital,Yes,No,–,3,3,–,# of Positions Filled:,506,7.9,40,3,8%,0.59%,40%,7%,0%
/Program/GetById/269,St Barnabas Hospital Program,http://www.sbhny.org/healthcare-professionals/residency-programs/dermatology-residency-program/,St Barnabas Hospital Program,803500129,Cindy Hoffman,,Tiffany Morris,1,1,1,Middle Atlantic,Community Hospital,Yes,Yes,–,–,# of Positions Filled:,1,1,308,0,0,1,#DIV/0!,0.32%,–,–,–
/Program/GetById/255,St John's Episcopal Hospital-South Shore Program,–,St John's Episcopal Hospital-South Shore Program,803500128,Suzanne Sirota Rozenberg,,Amber Johnson,3,3,3,Middle Atlantic,Community Hospital,Yes,No,–,–,# of Positions Filled:,–,# of Positions Filled:,48,52.1,25,,0%,0.00%,–,–,–
/Program/GetById/201,St Louis University School of Medicine Program,https://www.slu.edu/medicine/dermatology/,St Louis University School of Medicine Program,802821116,Nicole Burkemper,,Joey Weissmann,4,4,4,West North Central,University Hospital,Yes,No,–,–,# of Positions Filled:,6,5,616,6.5,40,6,15%,0.97%,38%,5%,5%
/Program/GetById/251,St Luke’s Hospital – Anderson Campus Program,http://gme.slhn.org,St Luke’s Hospital – Anderson Campus Program,804100107,Andrew Krakowski,,Deanna Kuhn,2,2,2,Middle Atlantic,Affiliated Hospital,Yes,No,–,–,# of Positions Filled:,2,2,478,10.9,52,2,4%,0.42%,–,–,–
/Program/GetById/200,Still OPTI Program,http://www.nermc.com/dermatology-residency,Still OPTI Program,802800117,David Cleaver,,Pamela Korff,2,2,2,West North Central,Affiliated Hospital,Yes,Yes,–,–,# of Positions Filled:,2,2,189,13.2,25,2,8%,1.06%,–,–,–
/Program/GetById/286,Stony Brook Medicine/University Hospital Program,https://www.stonybrookmedicine.edu/patientcare/Dermatology,Stony Brook Medicine/University Hospital Program,803521113,Jordan Slutsky,,Blair Bohnhorst,3,3,3,Middle Atlantic,University Hospital,Yes,No,–,–,# of Positions Filled:,3,3,605,10.9,66,3,5%,0.50%,67%,20%,0%
