Region,Name,ACGME Program Code,Program Director,Program Coordinator,PGY1,PGY2,PGY3,Institutional Setting,Participates in ERAS,Program has Osteopathic Recognition,# of Residents Who Were Graduates of a Joint MD-PhD program,Categorical Positions,Categorical Positions Filled,Advanced Positions Offered,Advanced Positions Filled,# of Applicants:,Interviewed:,Alpha Omega Alpha (AOA),Alpha Omega Alpha (AOA),Gold Humanism Honor Society (GHHS),Gold Humanism Honor Society (GHHS),Sigma Sigma Phi (SSP),Sigma Sigma Phi (SSP)
South Atlantic,AdventHealth Florida Program,4201112260,Robert Groves,Maria Mangual,4,4,4,Affiliated Hospital,Yes,No,–,–,# of Positions Filled:,4,4,712,12.6,20%,11%,0%,5%,5%,5%
East North Central,Advocate Health Care/Advocate Illinois Masonic Medical Center Program,4201621217,Loren Zuiderveld,Katelynn Greer,3,3,3,Affiliated Hospital,Yes,No,–,–,# of Positions Filled:,3,3,732,8.2,–,–,–,–,–,–
Middle Atlantic,Albany Medical Center Program,4203511121,christine Cooley,Camille Dumas,5,5,4,University Hospital,Yes,No,–,–,# of Positions Filled:,5,5,678,12.5,8%,11%,4%,5%,0%,5%
Middle Atlantic,Albert Einstein Healthcare Network/Einstein Medical Center Montgomery Program,4204100242,Brooke Devenney,Shannon McKane,3,3,2,Affiliated Hospital,Yes,No,–,–,# of Positions Filled:,3,3,596,0.7,0%,11%,6%,5%,6%,5%
Middle Atlantic,Albert Einstein Healthcare Network Program,4204121165,Ryan Smith,Nichole Adkinson,7,4,4,Affiliated Hospital,Yes,No,–,–,# of Positions Filled:,6,6,"1,112",9.9,4%,11%,11%,5%,4%,5%
Middle Atlantic,Allegheny Health Network Medical Education Consortium (AGH) Program,4204121176,William Peterson,Melissa Laity,6,7,7,Affiliated Hospital,Yes,No,–,–,# of Positions Filled:,7,7,798,14.3,0%,11%,3%,5%,9%,5%
Middle Atlantic,Arnot Ogden Medical Center Program,4203500256,Gerard Buffo,Melissa Mattison,2,2,2,Community Hospital,Yes,No,–,2,2,–,# of Positions Filled:,423,11.8,–,–,–,–,–,–
Arrowhead Regional Medical Center,Arrowhead Regional Medical Center Program,4200500001,John Sohn,Erica Cyr,0,0,0,Affiliated Hospital,Yes,No,–,–,# of Positions Filled:,2,2,261,30.7,–,–,–,–,–,–
East North Central,Ascension Providence/MSUCHM Program,4202521103,Mathew Chakko,Eutropia Rhodes,3,3,3,Affiliated Hospital,Yes,No,–,–,# of Positions Filled:,3,3,619,8.1,0%,11%,0%,5%,7%,5%
Middle Atlantic,Atlantic Health System/Morristown Medical Center Program,4203311116,Justin Alpert,Molly Crowley,5,5,5,Affiliated Hospital,Yes,No,–,–,# of Positions Filled:,5,5,648,12.8,8%,11%,4%,5%,8%,5%
East North Central,Aultman Hospital/Mercy/NEOMED Program,4203821232,Colleen Morris,Amanda Fouts,4,4,4,Affiliated Hospital,Yes,No,–,–,# of Positions Filled:,4,4,556,10.8,0%,11%,5%,5%,5%,5%
East North Central,Aurora Health Care Program,4205612213,William MacDonald,Camille Dykas,4,5,6,Community Hospital,Yes,No,–,4,4,–,# of Positions Filled:,689,13.2,0%,11%,5%,5%,5%,5%
South Atlantic,Baptist Health South Florida Program,4201100001,Katharine Lampen-Sachar,Claudia Pace,0,0,0,Community Hospital,–,No,–,–,# of Positions Filled:,–,# of Positions Filled:,0,–,–,–,–,–,–,–
East South Central,Baptist Memorial Medical Education Program,4204712186,John Stanfill,Angela Callens,6,6,7,Community Hospital,Yes,No,–,–,# of Positions Filled:,6,6,593,13.5,3%,11%,7%,5%,10%,5%
West South Central,Baylor College of Medicine Program,4204821195,Pedro Diaz-Marchan,Lori Burlin,12,12,12,University Hospital,Yes,No,–,–,# of Positions Filled:,12,12,"1,131",12.4,7%,11%,8%,5%,7%,5%
West South Central,Baylor University Medical Center Program,4204822190,Joseph Philip,Janet Palmer,7,7,7,Affiliated Hospital,Yes,No,–,5,5,2,2,958,10.6,36%,11%,8%,5%,0%,5%
East North Central,Beaumont Health (Dearborn) Program,4202512092,Graham Appleford,Via Barias,4,4,4,Affiliated Hospital,Yes,No,–,5,5,–,# of Positions Filled:,628,6.4,0%,11%,9%,5%,9%,5%
East North Central,Beaumont Health (Farmington Hills) Program,4202500105,Timothy McKnight,Kira Smith,2,2,2,Affiliated Hospital,Yes,No,–,3,3,1,1,588,7.0,–,–,–,–,–,–
East North Central,Beaumont Health (Royal Oak) Program,4202512102,Daniel Piziali,Janelle Adkins,6,6,6,Affiliated Hospital,Yes,No,–,8,8,–,# of Positions Filled:,795,18.1,15%,11%,12%,5%,0%,5%
New England,Beth Israel Deaconess Medical Center Program,4202421080,Jennifer Cutts,Katelyn Sullivan,8,8,8,University Hospital,Yes,No,1,–,# of Positions Filled:,8,8,918,21.8,8%,11%,5%,5%,0%,5%
New England,Boston University Medical Center Program,4202421081,Asim Mian,Yanqi Liu,10,10,9,University Hospital,Yes,No,–,–,# of Positions Filled:,9,9,"1,058",13.0,6%,11%,2%,5%,0%,5%
New England,Bridgeport Hospital/Yale University Program,4200812039,Kiran Sheikh,Eileana Valentin,4,4,4,Affiliated Hospital,Yes,No,–,–,# of Positions Filled:,4,4,783,10.2,0%,11%,0%,5%,0%,5%
New England,Brigham and Women's Hospital/Harvard Medical School Program,4202421085,Sara Durfee,Sandra Palma,8,8,8,University Hospital,Yes,No,1,–,# of Positions Filled:,7,7,947,9.0,31%,11%,8%,5%,0%,5%
East South Central,Brookwood Baptist Health Program,4200121006,Bibb Allen,Missy Fadlevich,4,4,4,Community Hospital,Yes,No,–,4,4,–,# of Positions Filled:,468,21.4,0%,11%,6%,5%,6%,5%
New England,Brown University Program,4204321183,Ana Lourenco,Jill Eastman,6,7,6,University Hospital,Yes,No,–,–,# of Positions Filled:,6,6,847,12.4,13%,11%,13%,5%,0%,5%
East North Central,Case Western Reserve University/University Hospitals Cleveland Medical Center Program,4203821153,Michael Wien,Emily Plas,9,10,9,University Hospital,Yes,No,2,–,# of Positions Filled:,9,9,"1,120",8.9,6%,11%,2%,5%,6%,5%
Pacific,Cedars-Sinai Medical Center Program,4200521018,Thomas Learch,Joseph Stuckelman,3,3,3,Community Hospital,Yes,No,–,–,# of Positions Filled:,3,3,632,8.5,–,–,–,–,–,–
South Atlantic,Christiana Care Health Services Program,4200911044,Mohammed Ali,Teresa Thuet,4,4,5,Affiliated Hospital,Yes,No,–,4,4,–,# of Positions Filled:,763,12.5,5%,11%,5%,5%,19%,5%
East North Central,Cleveland Clinic Foundation Program,4203812154,Joseph Veniero,Danielle Berry,8,8,8,Affiliated Hospital,Yes,No,–,–,# of Positions Filled:,8,8,"1,119",13.6,25%,11%,3%,5%,18%,5%
East North Central,Cook County Health and Hospitals System Program,4201621055,Morlie Wang,Anna Johnson,4,4,4,Affiliated Hospital,Yes,No,–,–,# of Positions Filled:,4,4,755,7.9,0%,11%,5%,5%,10%,5%
Middle Atlantic,Cooper Medical School of Rowan University/Cooper University Hospital Program,4203321244,Sabina Amin,Sandra Knapp,5,5,5,University Hospital,Yes,No,–,–,# of Positions Filled:,5,5,688,14.4,4%,11%,0%,5%,13%,5%
West North Central,Creighton University School of Medicine (Omaha) Program,4203021220,Johanna Schubert,Reva Aguilar,3,3,3,University Hospital,Yes,No,–,–,# of Positions Filled:,3,3,595,11.8,0%,11%,7%,5%,7%,5%
Mountain,Creighton University School of Medicine Program,4200312010,Dane Van Tassel,Roberta Valley,8,8,8,Affiliated Hospital,Yes,No,–,–,# of Positions Filled:,8,8,801,18.2,3%,11%,9%,5%,0%,5%
New England,Dartmouth-Hitchcock/Mary Hitchcock Memorial Hospital Program,4203211113,Stephanie Yen,Jill Rosenthal,3,3,2,University Hospital,Yes,No,–,–,# of Positions Filled:,3,3,626,17.3,13%,11%,0%,5%,13%,5%
Pacific,David Grant Medical Center Program,4200521001,Ely Wolin,Michelle Prince,3,3,3,Not Available,–,No,–,–,# of Positions Filled:,–,# of Positions Filled:,0,–,–,–,–,–,–,–
East North Central,Detroit Medical Center/Wayne State University Program,4202521096,Ali Harb,Nitasha Cheema,10,10,10,University Hospital,Yes,No,–,–,# of Positions Filled:,11,11,815,18.4,0%,11%,4%,5%,6%,5%
West South Central,"Doctors Hospital at Renaissance, Ltd. Program",4204800001,Mario Moya,Debra Gomez,0,0,0,Not Available,Yes,No,–,–,# of Positions Filled:,3,–,0,–,–,–,–,–,–,–
South Atlantic,Duke University Hospital Program,4203631149,Michael Taylor-Cho,Candie Stewart,10,10,10,University Hospital,Yes,No,2,–,# of Positions Filled:,10,10,"1,046",7.2,39%,11%,12%,5%,0%,5%
South Atlantic,Eastern Virginia Medical School Program,4205121202,Lester Johnson,Marleen Viola,5,3,4,University Hospital,Yes,No,–,–,# of Positions Filled:,5,5,803,11.8,5%,11%,10%,5%,0%,5%
South Atlantic,Emory University School of Medicine Program,4201221052,Christopher Ho,Angela Huff,14,14,13,University Hospital,Yes,No,6,–,# of Positions Filled:,14,14,"1,320",15.4,18%,11%,13%,5%,1%,5%
East North Central,Franciscan Health Olympia Fields Program,4201600679,Gregory Henkle,Kelly Deasy,3,3,4,Community Hospital,Yes,No,–,3,3,–,# of Positions Filled:,560,9.8,–,–,–,–,–,–
Middle Atlantic,Geisinger Health System Program,4204121163,Kayleigh Taylor,Melissa Rea,5,4,3,Community Hospital,Yes,No,–,–,# of Positions Filled:,5,5,806,9.9,0%,11%,0%,5%,18%,5%
South Atlantic,George Washington University Program,4201021046,John Lichtenberger,Norma Smith-Glenn,4,6,6,University Hospital,Yes,No,–,–,# of Positions Filled:,5,5,"1,067",9.4,8%,11%,0%,5%,0%,5%
Middle Atlantic,Harlem Hospital Center Program,4203521214,Sudha Ramachandran,Winsome Gordon,2,2,5,Affiliated Hospital,Yes,No,–,–,# of Positions Filled:,4,4,433,16.2,0%,11%,0%,5%,0%,5%
New England,Hartford Hospital Program,4200822041,Timothy Herbst,Paula Levenson,5,5,6,Affiliated Hospital,Yes,No,–,–,# of Positions Filled:,5,5,768,11.7,–,–,–,–,–,–
South Atlantic,HCA Florida Healthcare/Aventura Hospital Program,4201100262,Brett McKeon,Jane Rentas,5,5,5,Community Hospital,Yes,No,–,5,5,–,# of Positions Filled:,665,18.0,6%,11%,6%,5%,6%,5%
South Atlantic,HCA Florida Healthcare/USF Morsani College of Medicine GME Trinity Hospital Program,4201100263,Sandor Szilagyi,Jennifer Aceituno-Cardona,6,6,4,Affiliated Hospital,Yes,No,–,–,# of Positions Filled:,6,6,575,15.0,0%,11%,5%,5%,27%,5%
South Atlantic,HCA Healthcare/Mercer University School of Medicine/Memorial Health University Medical Center Program,4201212054,Dhruvkumar Patel,Antoinette McDonough,4,4,4,Affiliated Hospital,Yes,No,–,–,# of Positions Filled:,4,4,588,12.8,5%,11%,5%,5%,0%,5%
Pacific,HCA Healthcare Riverside Program,4200500916,Shiv Bhanu,Elizabeth Martinez,4,3,5,Affiliated Hospital,Yes,No,–,–,# of Positions Filled:,4,4,457,–,7%,11%,0%,5%,13%,5%
Mountain,HCA Healthcare Sunrise Health GME/MountainView Program,4203100001,Sean Beaty,Melinda Thrasher,5,5,5,Community Hospital,Yes,No,–,–,# of Positions Filled:,5,5,461,10.8,5%,11%,0%,5%,9%,5%
East North Central,Henry Ford Health/Henry Ford Hospital Program,4202511093,Brent Griffith,Alice Brown,8,8,8,Affiliated Hospital,Yes,No,–,8,8,–,# of Positions Filled:,788,15.2,3%,11%,8%,5%,5%,5%
Middle Atlantic,Icahn School of Medicine at Mount Sinai/Mount Sinai Hospital Program,4203521135,Kathleen Halton,Katharina Wang,8,8,7,University Hospital,Yes,No,1,–,# of Positions Filled:,7,7,988,10.1,3%,11%,5%,5%,0%,5%
Middle Atlantic,Icahn School of Medicine at Mount Sinai/West Program,4203521224,Amita Kamath,Paula Green,11,10,12,Affiliated Hospital,Yes,No,1,–,# of Positions Filled:,11,11,967,13.4,4%,11%,9%,5%,2%,5%
East North Central,Indiana University School of Medicine Program,4201721066,Atul Agarwal,John Donatelli,11,12,13,University Hospital,Yes,No,1,2,2,9,9,986,14.2,18%,11%,4%,5%,2%,5%
West South Central,Integris Health Program,4203912158,Clinton Williamson,Natasha Fanson,4,5,4,Community Hospital,Yes,No,–,–,# of Positions Filled:,4,4,458,13.1,–,–,–,–,–,–
Middle Atlantic,Jacobi Medical Center/Albert Einstein College of Medicine Program,4203521251,Robert Friedman,Cassandra Johnson,5,5,3,Affiliated Hospital,Yes,No,–,–,# of Positions Filled:,5,5,676,14.8,0%,11%,5%,5%,0%,5%
South Atlantic,Johns Hopkins University Program,4202311077,Erin Gomez,Dan Grupp,8,8,8,University Hospital,Yes,No,1,–,# of Positions Filled:,9,9,889,15.7,34%,11%,2%,5%,0%,5%
Pacific,Kaiser Permanente Southern California (Los Angeles) Program,4200512020,Lauren Peng,Brenda Merchan,2,2,2,Community Hospital,Yes,No,–,2,2,–,# of Positions Filled:,684,15.8,–,–,–,–,–,–
East North Central,Kettering Health Network Program,4203800244,Roland Gazaille,Tiffany Beverly,2,2,2,Community Hospital,Yes,No,–,–,# of Positions Filled:,2,2,506,8.7,–,–,–,–,–,–
Pacific,KPC Health Program,4200500915,Frederick White,Ann Allen,3,3,3,Community Hospital,Yes,No,–,3,3,–,# of Positions Filled:,422,7.6,–,–,–,–,–,–
New England,Lahey Clinic Program,4202422082,Jeremy Wortman,Nancy Holden,6,4,6,Affiliated Hospital,Yes,No,1,–,# of Positions Filled:,4,4,774,11.6,0%,11%,5%,5%,9%,5%
South Atlantic,Larkin Community Hospital Program,4201100261,Osmany DeAngelo,Yuris Marquez,4,4,4,Community Hospital,Yes,No,–,–,# of Positions Filled:,5,5,696,0.0,0%,11%,0%,5%,5%,5%
Pacific,Loma Linda University Health Education Consortium Program,4200521015,Erica Kinne,Claudia de Dios Uribe,9,8,9,University Hospital,Yes,No,–,–,# of Positions Filled:,9,9,619,–,5%,11%,7%,5%,0%,5%
Pacific,Los Angeles County-Harbor-UCLA Medical Center Program,4200511035,Patrick Choi,Brigitte Rodriguez,6,6,6,Affiliated Hospital,Yes,No,–,–,# of Positions Filled:,6,6,631,14.9,10%,11%,7%,5%,0%,5%
West South Central,Louisiana State University (Shreveport) Program,4202111075,Alberto Simoncini,Elizabeth Winkler,4,4,4,Affiliated Hospital,Yes,No,–,5,5,–,# of Positions Filled:,623,11.2,–,–,–,–,–,–
West South Central,Louisiana State University School of Medicine Program,4202131259,Mignonne Morrell,Dana Brian,5,5,5,University Hospital,Yes,No,–,–,# of Positions Filled:,5,5,728,16.6,4%,11%,4%,5%,11%,5%
East North Central,Loyola University Medical Center Program,4201611064,Albert Song,Linda James,7,7,7,University Hospital,Yes,No,–,–,# of Positions Filled:,7,7,971,10.3,6%,11%,3%,5%,8%,5%
Pacific,Madigan Army Medical Center Program,4205421239,Erik Dedekam,Teresa Tucker,4,4,6,Military,–,No,–,–,# of Positions Filled:,–,# of Positions Filled:,0,–,–,–,–,–,–,–
Middle Atlantic,Maimonides Medical Center Program,4203521221,Daniel Masri,Rosa Duluc,4,4,4,Affiliated Hospital,Yes,No,–,–,# of Positions Filled:,4,4,698,22.6,15%,11%,5%,5%,0%,5%
New England,Maine Medical Center Program,4202211076,Jennifer Talmadge,Rae Newland,3,3,3,Affiliated Hospital,Yes,No,–,3,3,–,# of Positions Filled:,657,6.8,0%,11%,0%,5%,20%,5%
New England,Massachusetts General Hospital/Harvard Medical School Program,4202431083,Shaunagh McDermott,Jacqueline Williams-Johnson,8,7,8,University Hospital,Yes,No,3,–,# of Positions Filled:,8,8,936,15.5,40%,11%,8%,5%,0%,5%
South Atlantic,Mayo Clinic College of Medicine and Science (Jacksonville) Program,4201121250,Shweta Bhatt,Suzanne Taylor,5,5,4,Other,Yes,No,–,5,5,–,# of Positions Filled:,"1,064",11.3,4%,11%,0%,5%,17%,5%
Mountain,Mayo Clinic College of Medicine and Science (Phoenix) Program,4200300935,Michael Fox,Silvana D'Alessandro,4,4,4,Other,Yes,No,–,6,6,2,2,881,7.9,46%,11%,8%,5%,0%,5%
West North Central,Mayo Clinic College of Medicine and Science (Rochester) Program,4202621105,Katie Hunt,Holly Kreidermacher,13,12,12,Other,Yes,No,1,–,# of Positions Filled:,15,15,807,24.8,34%,11%,13%,5%,0%,5%
East North Central,McGaw Medical Center of Northwestern University Program,4201621059,Ankur Garg,Holly Harper,10,9,10,University Hospital,Yes,No,2,–,# of Positions Filled:,10,10,"1,170",12.0,44%,11%,8%,5%,2%,5%
East North Central,McLaren Health Care/Oakland/MSU Program,4202500106,Kevin Carter,Jason Quintanilla,3,3,3,Affiliated Hospital,Yes,No,–,3,3,–,# of Positions Filled:,527,9.5,–,–,–,–,–,–
South Atlantic,Medical College of Georgia Program,4201221053,William Parker,Bruce Gilbert,5,6,5,University Hospital,Yes,No,–,–,# of Positions Filled:,5,5,936,14.1,4%,11%,0%,5%,23%,5%
East North Central,Medical College of Wisconsin Affiliated Hospitals Program,4205621211,Mark Hohenwalter,Melissa DuBois,7,6,6,University Hospital,Yes,No,–,–,# of Positions Filled:,8,8,855,16.4,18%,11%,9%,5%,3%,5%
South Atlantic,Medical University of South Carolina Program,4204521184,Seth Stalcup,Tina Rapstine,11,11,11,University Hospital,Yes,No,–,–,# of Positions Filled:,11,11,974,22.6,27%,11%,9%,5%,11%,5%
South Atlantic,MedStar Health/Georgetown University Hospital Program,4201011045,Peter Bergquist,Amy Burke,4,4,4,University Hospital,Yes,No,–,–,# of Positions Filled:,4,4,"1,076",13.9,5%,11%,0%,5%,0%,5%
Middle Atlantic,Mercy Catholic Medical Center Program,4204121170,Justin Mackey,Kimberly Young-Brown,2,3,3,Affiliated Hospital,Yes,No,–,3,3,–,# of Positions Filled:,658,9.1,0%,11%,0%,5%,0%,5%
West South Central,Methodist Hospital (Houston) Program,4204800935,Elliott Friedman,Sheori Sinegal,4,4,4,Affiliated Hospital,Yes,No,–,–,# of Positions Filled:,4,4,687,11.6,21%,11%,0%,5%,0%,5%
Middle Atlantic,Montefiore Medical Center/Albert Einstein College of Medicine Program,4203521126,Judah Burns,Emily Ofrias,7,7,7,University Hospital,Yes,No,–,–,# of Positions Filled:,7,7,794,15.1,23%,11%,6%,5%,0%,5%
New England,Mount Auburn Hospital Program,4202411087,Donald Romanelli,Annika Mitchell,3,3,3,Affiliated Hospital,Yes,No,–,–,# of Positions Filled:,3,3,701,21.4,13%,11%,7%,5%,0%,5%
South Atlantic,Mount Sinai Medical Center of Florida Program,4201121050,William Burke,Kiesha Candry-Scatliffe,5,4,5,Affiliated Hospital,Yes,No,–,–,# of Positions Filled:,5,5,965,10.4,0%,11%,0%,5%,8%,5%
Middle Atlantic,Nassau University Medical Center Program,4203511123,Salman Shah,Melissa Goldsmith,4,4,4,Affiliated Hospital,Yes,No,–,–,# of Positions Filled:,4,4,656,20.6,5%,11%,0%,5%,0%,5%
South Atlantic,National Capital Consortium Program,4201021247,Paul Peterson,Anita McKenzie,6,7,7,Not Available,–,No,–,–,# of Positions Filled:,–,# of Positions Filled:,0,–,–,–,–,–,–,–
South Atlantic,Naval Medical Center (Portsmouth) Program,4205113252,Matthew Lutynski,Janett Dekle,5,3,4,Not Available,–,No,–,–,# of Positions Filled:,–,# of Positions Filled:,0,–,–,–,–,–,–,–
Pacific,Naval Medical Center (San Diego) Program,4200521914,Richard Montgomery,Roberta Vigil,4,4,3,Not Available,–,No,–,–,# of Positions Filled:,–,# of Positions Filled:,0,–,–,–,–,–,–,–
Middle Atlantic,New York Presbyterian Hospital (Columbia Campus) Program,4203511138,Jasnit Makkar,Sheik Amin,6,6,6,University Hospital,Yes,No,1,–,# of Positions Filled:,6,6,882,11.3,27%,11%,7%,5%,0%,5%
Middle Atlantic,New York Presbyterian Hospital (Cornell Campus) Program,4203521129,Andrew Schweitzer,Michelle Byrne,6,6,6,University Hospital,Yes,No,1,–,# of Positions Filled:,7,7,847,14.8,23%,11%,10%,5%,0%,5%
New England,Norwalk Hospital Program,4200821216,Francis Flaherty,Anila Dalipi,3,2,3,Affiliated Hospital,Yes,No,–,–,# of Positions Filled:,3,3,642,15.1,8%,11%,0%,5%,15%,5%
Middle Atlantic,NYU Grossman School of Medicine Program,4203521137,Cecilia Mercado,Zudith Lopez,10,7,8,University Hospital,Yes,No,1,–,# of Positions Filled:,10,10,851,10.6,15%,11%,7%,5%,0%,5%
Middle Atlantic,NYU Long Island School of Medicine Program,4203521240,Jason Hoffmann,Denise Foti,0,5,5,University Hospital,–,No,–,–,# of Positions Filled:,–,# of Positions Filled:,0,–,–,–,–,–,–,–
West South Central,Ochsner Clinic Foundation Program,4202112074,James Milburn,Katherine Dixon,5,6,6,Community Hospital,Yes,No,–,5,5,1,1,721,11.1,19%,11%,4%,5%,0%,5%
East North Central,Ohio State University Hospital Program,4203821156,Mark King,Samantha Schnitzer,8,7,5,University Hospital,Yes,No,–,–,# of Positions Filled:,11,11,936,12.6,5%,11%,7%,5%,2%,5%
West South Central,Oklahoma State University Center for Health Sciences Program,4203900160,Donald von Borstel,Christa Arnold,4,3,3,Affiliated Hospital,Yes,Yes,–,–,# of Positions Filled:,3,3,372,9.4,–,–,–,–,–,–
Pacific,Oregon Health & Science University Program,4204031160,Brooke Beckett,Kim Eastman,5,7,7,University Hospital,Yes,No,–,–,# of Positions Filled:,5,5,883,–,30%,11%,11%,5%,4%,5%
Middle Atlantic,Penn State Milton S Hershey Medical Center Program,4204121164,Donald Flemming,Christina Moorhead,6,7,8,University Hospital,Yes,No,–,–,# of Positions Filled:,6,6,905,10.5,0%,11%,3%,5%,17%,5%
Pacific,Providence Sacred Heart Medical Center (Spokane) Program,4205421207,Jeffrey Nackos,Megan Crawshaw,0,1,2,Not Available,–,No,–,–,# of Positions Filled:,–,# of Positions Filled:,0,–,–,–,–,–,–,–
New England,Quinnipiac University Frank H. Netter MD School of Medicine/St VIncent's Medical Center Program,4200811040,Joshua Sapire,Cristina Vaz,3,3,4,Affiliated Hospital,Yes,No,–,–,# of Positions Filled:,3,3,661,7.6,0%,11%,0%,5%,0%,5%
Middle Atlantic,Richmond University Medical Center Program,4203521229,Sujoy Menon,Renee Cairney,2,2,2,Affiliated Hospital,Yes,No,–,–,# of Positions Filled:,2,2,495,12.1,–,–,–,–,–,–
Pacific,Riverside University Health System Program,4200500917,Monika Kief-Garcia,Jenni Shieck,2,2,0,Affiliated Hospital,Yes,No,–,2,2,–,# of Positions Filled:,470,13.4,–,–,–,–,–,–
Middle Atlantic,Rochester General Hospital Program,4203512145,Joel Thompson,Raquel Redman,4,4,4,Affiliated Hospital,Yes,No,–,–,# of Positions Filled:,5,5,724,15.2,0%,11%,4%,5%,0%,5%
East North Central,Rush University Medical Center Program,4201611060,Michael Ralls,Lakesha Hudson,5,5,5,University Hospital,Yes,No,–,–,# of Positions Filled:,5,5,"1,092",7.3,4%,11%,0%,5%,0%,5%
Middle Atlantic,Rutgers Health/Cooperman Barnabas Medical Center Program,4203321215,Lyle Gesner,Jason Satterthwaite,4,5,3,Affiliated Hospital,Yes,No,–,–,# of Positions Filled:,–,# of Positions Filled:,643,24.9,–,–,–,–,–,–
Middle Atlantic,Rutgers Health/Monmouth Medical Center Program,4203331115,Stanley Lu,Deonna Williams-Square,3,3,2,Affiliated Hospital,Yes,No,–,–,# of Positions Filled:,–,# of Positions Filled:,467,16.1,–,–,–,–,–,–
Middle Atlantic,Rutgers Health/New Jersey Medical School Program,4203321226,Pierre Maldjian,Anny Robles,5,4,5,University Hospital,Yes,No,–,–,# of Positions Filled:,12,12,807,24.8,7%,11%,3%,5%,10%,5%
Middle Atlantic,Rutgers Health/Newark Beth Israel Medical Center Program,4203331118,Luke Partyka,Maria Figueroa,3,3,3,Affiliated Hospital,Yes,No,–,–,# of Positions Filled:,–,# of Positions Filled:,617,13.0,–,–,–,–,–,–
Middle Atlantic,Rutgers Health/Robert Wood Johnson Medical School Program,4203321228,Jeffrey Kempf,Jasmine Allen,4,4,5,University Hospital,Yes,No,–,–,# of Positions Filled:,6,6,715,14.0,5%,11%,9%,5%,9%,5%
West South Central,San Antonio Uniformed Services Health Education Consortium Program,4204821248,Francis Cloran,Megan Tierney,9,8,9,Not Available,–,No,–,–,# of Positions Filled:,–,# of Positions Filled:,0,–,–,–,–,–,–,–
Pacific,Santa Barbara Cottage Hospital Program,4200522033,Bernard Chow,Selena Kelley,4,4,3,Community Hospital,Yes,No,–,–,# of Positions Filled:,4,4,560,12.9,5%,11%,0%,5%,0%,5%
Pacific,Santa Clara Valley Medical Center Program,4200531032,Vanessa Starr,Melinda Aguilar,5,4,4,Affiliated Hospital,Yes,No,–,–,# of Positions Filled:,5,5,558,22.8,13%,11%,4%,5%,0%,5%
Middle Atlantic,Sidney Kimmel Medical College at Thomas Jefferson University/TJUH Program,4204111174,Suzanne Long,Sofiane Moulla,7,9,10,University Hospital,Yes,No,–,–,# of Positions Filled:,8,8,"1,047",11.4,10%,11%,8%,5%,0%,5%
East North Central,Southern Illinois University Program,4201621065,Vincent Zata,Shannon Boxman,3,3,3,Affiliated Hospital,Yes,No,–,4,4,–,# of Positions Filled:,608,16.4,7%,11%,13%,5%,7%,5%
East North Central,Spectrum Health/Michigan State University Program,4202521099,Andrew Woodrow,Andrea Morse,3,3,3,Affiliated Hospital,Yes,No,–,3,3,–,# of Positions Filled:,739,10.3,13%,11%,7%,5%,20%,5%
West North Central,St Louis University School of Medicine Program,4202821110,Alejandro Mendez Castillo,Genevieve Desloge,6,6,7,Affiliated Hospital,Yes,No,–,–,# of Positions Filled:,6,6,775,12.9,0%,11%,0%,5%,7%,5%
Middle Atlantic,St Luke’s Hospital – Anderson Campus Program,4204100001,Pallav Shah,Camryn LaSelva,0,0,0,Affiliated Hospital,Yes,No,–,–,# of Positions Filled:,12,12,0,–,0%,11%,8%,5%,8%,5%
New England,St Vincent Hospital Program,4202412089,David Bader,Robin Simons,4,4,4,Community Hospital,Yes,No,–,–,# of Positions Filled:,4,4,643,7.8,0%,11%,0%,5%,0%,5%
Pacific,Stanford Health Care-Sponsored Stanford University Program,4200521034,Margaret Lin,Carine Jaeger,9,9,9,University Hospital,Yes,No,6,–,# of Positions Filled:,9,9,834,13.4,20%,11%,11%,5%,0%,5%
Middle Atlantic,Stony Brook Medicine/University Hospital Program,4203521222,Kevin Baker,Linda Erickson,6,6,6,University Hospital,Yes,No,1,–,# of Positions Filled:,6,6,767,24.1,6%,11%,6%,5%,0%,5%
Middle Atlantic,SUNY Downstate Health Sciences University Program,4203521143,Rhonda Osborne,Gladys Ortiz,7,8,8,University Hospital,Yes,No,–,–,# of Positions Filled:,8,8,815,13.4,0%,11%,3%,5%,8%,5%
Middle Atlantic,SUNY Upstate Medical University Program,4203521147,Andrij Wojtowycz,Carolyn Snyder,7,7,7,University Hospital,Yes,No,–,–,# of Positions Filled:,7,7,703,17.8,0%,11%,0%,5%,3%,5%
Middle Atlantic,Temple University Hospital Program,4204111173,Beverly Hershey,Yolanda Reyes,5,4,3,University Hospital,Yes,No,–,–,# of Positions Filled:,5,5,"1,009",5.6,4%,11%,0%,5%,9%,5%
West South Central,Texas A&M College of Medicine-Scott and White Medical Center (Temple) Program,4204811198,James Schnitker,Melisa Harris Pates,6,7,6,Affiliated Hospital,Yes,No,–,–,# of Positions Filled:,7,7,678,13.3,21%,11%,6%,5%,15%,5%
West South Central,Texas Tech University HSC El Paso Program,4204812257,Jesus Diaz,Terri Brashear,3,3,3,Affiliated Hospital,Yes,No,–,–,# of Positions Filled:,3,3,651,7.4,0%,11%,7%,5%,0%,5%
